{
  "evidence_id": "test_runner",
  "claim": "test_runner",
  "artifact_path": "projects/ForestVol/data/processed/RUN-HITO-0-5F/rf09-evidence.json",
  "checksum": "fc5cc06ca0064f12a3f5b230872fca54d9bba636e5f3cea21cb45dd56091427d",
  "validator": "test_runner",
  "timestamp": "2026-06-22T01:52:25.147196+00:00",
  "result": "pass"
}